{
  "schema_version": "open_agronomy_agent.knowledge_graph_manifest.v1",
  "graph_id": "soilwise.soil_health",
  "version": "15593868+9e73db954212",
  "data_path": "soilwise_knowledge_graph.json",
  "namespaces": [
    "fertility",
    "regional_environment",
    "soil_health",
    "soil_water"
  ],
  "source": "https://zenodo.org/records/15593868",
  "license": "CC-BY-4.0",
  "sha256": "9e73db954212216241b4b77d63088d4671fa017539e5309ee71e444b086a618b",
  "authority_role": "vocabulary_hint",
  "priority": 50,
  "collision_policy": "error",
  "relation_vocabulary": [
    "broader",
    "exact_match",
    "narrower",
    "related_to"
  ]
}
